{
  "contract_id": "01HXABC123DEF456GHJ789KLM2",
  "parent_contract_id": null,
  "intent_id": "01HXABC123DEF456GHJ789KLM0",
  "plan_id": "01HXABC123DEF456GHJ789KLM1",
  "workflow_id": "lead_qualification",
  "workflow_version": "1.3.0",
  "step_id": "classify",
  "tool_name": "classify_lead_intent",
  "tool_version": "1.0.0",
  "tool_implementation": {
    "protocol": "mcp",
    "transport": "stdio",
    "endpoint": "sha256:abc123",
    "image_digest": "sha256:abc123def456"
  },
  "agent_role": "lead_qualifier",
  "model_class": "low_cost_extract",
  "execution_mode": "probabilistic",
  "input_schema_ref": "lead_intent_input@v1",
  "output_schema_ref": "lead_intent_output@v1",
  "input": { "email_body": "Hello, I'd like to learn more about your product." },
  "required_capabilities": ["crm_read"],
  "declared_side_effects": [],
  "cost_budget": {
    "class": "standard",
    "ceiling_usd": 0.50
  },
  "policy_decisions": [
    {
      "policy": "capability_check",
      "decision": "allow",
      "reason": "crm_read granted",
      "evaluated_at": "2026-04-26T12:00:00Z"
    }
  ],
  "observability": {
    "trace_id": "trace-001",
    "span_id": "span-001",
    "langfuse_session_id": "lf-session-001"
  },
  "caller_context": {
    "caller_type": "n8n",
    "source": "n8n:workflow_42:exec_9876"
  },
  "created_at": "2026-04-26T12:00:00Z",
  "signed_by": "paperclipai@v0.1.0"
}
